{
  "schema_version": "smpcc-r8-liquid-s6-final-delivery-policy-v2",
  "document_type": "SMPCC_R8_LIQUID_S6_FINAL_DELIVERY_POLICY_V2",
  "policy_id": "liquid_zrj_msi_u2404_s6_final_delivery_policy_v2",
  "status": "NOT_ADMITTED_FINALIZED_S5B0_REPLAY_REQUIRED",
  "selection": {
    "attempt_id": "SIM-S1_CORE_H1_C1_Bsmooth_b01_r01",
    "role": "PRIMARY_ONLY",
    "planned_denominator": 1,
    "optional_bag_read": false,
    "paired_or_cross_method_ranking_allowed": false,
    "selected_trajectory_cpu_comparison": "OUT_OF_SCOPE"
  },
  "s5b0_parent": {
    "state": "NOT_MATERIALIZED",
    "required_execution_status": "S5B0_PRIMARY_R7_EXECUTED_MOTION_REPLAY_PASS_DEVELOPMENT_ONLY",
    "required_frame_manifest_status": "PASS_S5B0_FINALIZED_SOLVER_FRAMES_MANIFEST_V1",
    "package_root": null,
    "package_root_sha256": null,
    "execution_receipt_sha256": null,
    "result_qc_sha256": null,
    "frame_manifest_sha256": null,
    "gauge_manifest_sha256": null,
    "checksums_sha256": null
  },
  "s5b0_v4_binding": {
    "policy_path": "config/target_hosts/liquid_zrj_msi_u2404_s5b0_replay_admission_policy_v4.json",
    "policy_sha256": "d972f66d14882c28abe5629828d2ccaab1013f82a65b82f6250cf55716e41f21",
    "policy_schema_sha256": "897d617b56619b3761025eff64d27f68977ae9d15ac8ac481cea3beaea099d66",
    "gauge_contract_sha256": "d0cde7388bf0984ca664258e22cf00dc5f1702951811d5cb29c3282e57583328"
  },
  "gauge_contract": {
    "measurement_source": "RAW_NATIVE_JGAUGESWL_CSV",
    "probe_count": 16,
    "attachment_frame": "MOVING_CONTAINER_REFERENCE_REF_0",
    "update_semantics": "PATCHED_EACH_SOLVER_STEP_BEFORE_GAUGE_COMPUTE",
    "world_fixed_xml_gauge_allowed": false,
    "q98_proxy_allowed": false,
    "is_solver_gauge": true,
    "class_name": "JGaugeSwl",
    "probe_radius_m": 0.0145,
    "point0_z_m": 0.002,
    "point2_z_m": 0.064,
    "pointdp_m": 0.001,
    "masslimit_coef": 0.5,
    "compute_dt_s": 0.05,
    "output_dt_s": 0.05,
    "h0_m": 0.058,
    "invalid_rule": "NONFINITE_OR_OUTSIDE_CLOSED_POINT0_POINT2_SEGMENT",
    "maximum_invalid_ratio": 0.001,
    "raw_output_pattern": "GaugesSwl_s5b0_p00..s5b0_p15.csv",
    "derived_output": "gauge_zsurf.csv",
    "probes": [
      {"name":"s5b0_p00","angle_deg":0.0,"x_m":0.0145,"y_m":0.0},
      {"name":"s5b0_p01","angle_deg":22.5,"x_m":0.013396253221413659,"y_m":0.005548909769293802},
      {"name":"s5b0_p02","angle_deg":45.0,"x_m":0.010253048327204941,"y_m":0.010253048327204939},
      {"name":"s5b0_p03","angle_deg":67.5,"x_m":0.005548909769293803,"y_m":0.013396253221413659},
      {"name":"s5b0_p04","angle_deg":90.0,"x_m":0.0,"y_m":0.0145},
      {"name":"s5b0_p05","angle_deg":112.5,"x_m":-0.005548909769293802,"y_m":0.013396253221413659},
      {"name":"s5b0_p06","angle_deg":135.0,"x_m":-0.010253048327204939,"y_m":0.010253048327204941},
      {"name":"s5b0_p07","angle_deg":157.5,"x_m":-0.013396253221413659,"y_m":0.005548909769293803},
      {"name":"s5b0_p08","angle_deg":180.0,"x_m":-0.0145,"y_m":0.0},
      {"name":"s5b0_p09","angle_deg":202.5,"x_m":-0.01339625322141366,"y_m":-0.005548909769293801},
      {"name":"s5b0_p10","angle_deg":225.0,"x_m":-0.010253048327204943,"y_m":-0.010253048327204939},
      {"name":"s5b0_p11","angle_deg":247.5,"x_m":-0.00554890976929381,"y_m":-0.013396253221413655},
      {"name":"s5b0_p12","angle_deg":270.0,"x_m":0.0,"y_m":-0.0145},
      {"name":"s5b0_p13","angle_deg":292.5,"x_m":0.005548909769293805,"y_m":-0.013396253221413657},
      {"name":"s5b0_p14","angle_deg":315.0,"x_m":0.010253048327204937,"y_m":-0.010253048327204943},
      {"name":"s5b0_p15","angle_deg":337.5,"x_m":0.013396253221413655,"y_m":-0.005548909769293811}
    ]
  },
  "execution_contract": {
    "commands": ["admit", "extract-selected", "analyze", "render-figure", "render-media", "publish", "accept", "run-one-shot"],
    "real_parent_required": true,
    "external_writes_allowed": false,
    "create_new_only": true,
    "required_inventory": [
      "data/raw_gauge_zsurf.json",
      "data/aligned_primary_comparison.csv",
      "reports/analysis_result.json",
      "figures/primary_shared_x_timeseries.png",
      "figures/primary_shared_x_timeseries_grayscale.png",
      "figures/primary_shared_x_timeseries.pdf",
      "animation/primary.mp4",
      "animation/primary_preview.gif",
      "keyframes/primary_first.png",
      "keyframes/primary_middle.png",
      "keyframes/primary_last.png",
      "comparison_manifest.json",
      "evidence_index.json",
      "liquid_secondary_ledger.jsonl",
      "secondary_ledger_append_receipt.json",
      "acceptance_receipt.json",
      "checksums.sha256"
    ]
  },
  "claim_ceiling": {
    "maximum_real_status": "S6_PRIMARY_R7_BAG_REPLAY_AND_MODEL_COMPARISON_PASS_DEVELOPMENT_ONLY",
    "stage6_pass_now": false,
    "physical_reference_pending": true,
    "physical_fidelity_validated": false,
    "formal": false,
    "production": false,
    "physical_primary": false
  }
}
